ID,TRICHYEU,NGAYKY,CV_KHAN
629040,"TB kết luận họp Hội đồng thẩm định hồ sơ điều chỉnh quy hoạch tổng thể phát triển kinh tế - xã hội huyện Nhơn Trạch đến năm 2020, tầm nhình đến 2025.",1/16/2017 0:00,Thường
628711,Trao đổi kinh nghiệm về xây dựng hệ thống chia sẻ thông tin đât đai,4/7/2017 0:00,Thường
629048,Triển khai Đo đạc bản đồ hiện trạng và trích đất quốc phòng..,1/19/2017 0:00,Thường
628717,Triển khai hướng dẫn xác định và quản lý chi phí khảo sát xây dựng trên địa bàn tỉnh,4/7/2017 0:00,Thường
629251,Triển khai Quyết định số 2660/QD-BTC ngày 14/12/2016 của Bộ Tài chính.,1/11/2017 0:00,Thường
629252,triển khai thông tư số 319/2019/TT-BTC ngày 13/12/2016 của Bộ Tài chính,1/11/2017 0:00,Thường
629052,Triển khai thực hiện Thông tư 259/2016/Chuyển Thanh tra sở theo dõi-BTC,1/19/2017 0:00,Thường
628837,"V/v góp ý dự thảo Quyết định bàn hành quy định mức trợ cấp xã hội, mức trợ giúp xã hôi cho các đối tượng bảo trợ xã hội trên địa bàn tỉnh Đồng Nai.",1/20/2017 0:00,Thường
629041,V/v hủy bỏ Quyết định số 4519/QĐ-UBND ngày 30/11/2005 của Chủ tịch UBND tỉnh Đồng Nai.,1/17/2017 0:00,Thường
628839,V/v kiện toàn Hội đồng quản lý Quỹ bảo vệ và phát triển rừng tỉnh ĐN,1/19/2017 0:00,Thường
629247,"V/v lấy ý kiến dự án TTĐĐ đầu tư sản xuất kinh doanh tại xã Long Phước, huyện Long Thành, tỉnh Đồng Nai",1/13/2017 0:00,Thường
629246,"V/v lấy ý kiến dự án TTĐĐ đầu tư sản xuất kinh doanh tại xã Long Tân, huyện Nhơn Trạch, tỉnh Đồng Nai",1/12/2017 0:00,Thường
628841,V/v nộp tiền cấp tiền khai thác khoáng sản 2017,1/19/2017 0:00,Thường
628835,"V/v phê duyệt kết quả thực hiện nhiệm vụ ""Xây dựng cơ sở dữ liệu môi trường, tài nguyên nước, khoáng sản, thanh tra - kiểm tra"".",12/29/2016 0:00,Thường
628840,"V/v phê duyệt quy hoạch hệ thống chế biến bảo quản cà phê gắn với sản xuất và xuất khẩu đến năm 2020, định hướng đến năm 2030 trên địa bàn tỉnh Đồng Nai.",12/30/2016 0:00,Thường
629249,V/v tham mưu báo cáo kết quả thực hiện một số nội dung theo Văn bản số 2624-CV/TU ngày 09/01/2017 của Thường trực Tỉnh ủy.,1/16/2017 0:00,Thường
629042,"V/v Thay đổi địa điểm làm việc của HĐND, UBND huyện Long Thành",1/13/2017 0:00,Thường
629250,V/v triển khai Thông tư số 196/2016/TT-BTC ngày 08/11/2016 của Bộ Tài chính.,1/11/2017 0:00,Thường
628836,"V/v triển khai ý kiến chỉ đạo của Thủ tướng Chính phủ tại kỳ họp thứ 2, QH khóa XIV.",1/17/2017 0:00,Thường
628838,V/v xử lý kiến nghị về đất đai tại phường Tân Hiệp.,1/20/2017 0:00,Thường
628715,Viết bài Bản tin TNMT năm 2017,4/7/2017 0:00,Thường
629050,Xin điều chỉnh tên công ty ghi tại hx xin thuê 638.352m2..,1/19/2017 0:00,Thường
629053,Xử lý đơn đề nghị miễn tiền SDD của bà Lại Thị Doàn,1/19/2017 0:00,Thường
629049,Xử lý kết quả thẩm tra hs cấp GCNQSDD của bà Nguyễn Thị Đào,1/19/2017 0:00,Thường
629245,"Xử phạt VPHC về bảo vệ môi trường công ty TNHH Hoàng Việt Nhất của bà Nguyễn Thị Luật, phường Hố Nai",12/23/2016 0:00,Thường
